{
  "schema_version": "1.0",
  "skill_name": "rigorous-reviewer",
  "purpose": "Trigger routing hints for host agents and installers. These terms do not replace the SKILL.md description; they reduce ambiguity across multi-skill environments.",
  "strong_trigger_keywords": [
    "rigorous review",
    "scientific peer review",
    "manuscript review",
    "preprint review",
    "proposal review",
    "grant review",
    "referee report",
    "reviewer 2",
    "editorial recommendation",
    "top-journal review",
    "Nature review",
    "Cell review",
    "Science review",
    "CNS-level review",
    "journal-level estimate",
    "accept minor revision major revision reject",
    "central claim",
    "claim strength",
    "decisive evidence",
    "evidence sufficiency",
    "evidence ledger",
    "alternative explanation",
    "hidden loophole",
    "critical flaw",
    "major issue",
    "minor issue",
    "red-line audit",
    "novelty claim",
    "overclaiming",
    "reproducibility audit",
    "methodological loophole",
    "statistical validity",
    "benchmark integrity",
    "artifact reproducibility",
    "code artifact review",
    "clinical model validation",
    "external validation",
    "calibration discrimination",
    "orthogonal validation",
    "causal claim",
    "mechanistic evidence",
    "proof review",
    "theorem review",
    "field evidence map",
    "gold-paper calibration"
  ],
  "chinese_trigger_keywords": [
    "严格审稿",
    "科学审稿",
    "顶刊审稿",
    "CNS审稿",
    "Nature审稿",
    "Cell审稿",
    "Science审稿",
    "论文审稿",
    "预印本审稿",
    "基金评审",
    "proposal审查",
    "审稿意见",
    "评审意见",
    "reviewer 2",
    "期刊级别评估",
    "能发什么期刊",
    "顶刊水平",
    "中心claim",
    "中心结论",
    "主要结论",
    "决定性证据",
    "证据是否充分",
    "证据链",
    "替代解释",
    "隐藏漏洞",
    "关键缺陷",
    "致命缺陷",
    "Major revision",
    "Reject",
    "新颖性",
    "过度声称",
    "机制证据",
    "因果claim",
    "统计有效性",
    "可重复性",
    "benchmark有效性",
    "代码可重复性",
    "外部验证",
    "正交验证",
    "需要什么补实验",
    "最小补实验包"
  ],
  "weak_context_keywords": [
    "evaluate",
    "critique",
    "assess",
    "red flag",
    "fatal flaw",
    "journal fit",
    "novelty",
    "limitations",
    "evidence gap",
    "robustness",
    "reproducibility",
    "method critique",
    "statistics critique",
    "benchmark critique",
    "revision feasibility"
  ],
  "negative_routing_keywords": [
    "protocol",
    "SOP",
    "bench protocol",
    "wet-lab protocol",
    "experimental procedure",
    "实验protocol",
    "实验步骤",
    "操作流程",
    "SOP审查",
    "bench note",
    "polish",
    "copyedit",
    "language editing",
    "Nature-style polishing",
    "figure styling",
    "figure beautification",
    "PPT",
    "slides",
    "citation formatting",
    "literature lookup only",
    "database lookup only",
    "code debugging only"
  ],
  "routing_rules": [
    {
      "condition": "The user asks whether a manuscript, preprint, proposal, figure set, dataset, proof, model, code artifact, or central scientific claim is convincing, publishable, novel, or sufficiently supported.",
      "action": "Use rigorous-reviewer."
    },
    {
      "condition": "The user asks to rewrite or audit a biological protocol, SOP, bench note, or wet-lab workflow for execution readiness.",
      "action": "Route to biological-protocol-reviewer if installed; otherwise state that this skill can only review the scientific claim and protocol-derived evidence, not generate a full SOP."
    },
    {
      "condition": "The user asks only for language polishing, figure styling, reviewer response drafting, citation formatting, or paper-to-PPT conversion.",
      "action": "Do not trigger rigorous-reviewer unless the user explicitly asks for scientific critique or claim stress-testing."
    },
    {
      "condition": "The user asks only for paper lookup, database lookup, citation graph search, or public accession verification.",
      "action": "Use lookup/database companion skills if installed; trigger rigorous-reviewer only for synthesis and final scientific judgment."
    }
  ],
  "activation_examples": [
    "Use Rigorous-Reviewer to review this manuscript.",
    "这个文章如果做出来能发哪个期刊？",
    "Does this central claim have decisive evidence?",
    "Find the hidden loopholes and alternative explanations.",
    "Give reviewer 2 style Critical/Major/Minor comments.",
    "Audit this paper for novelty, reproducibility, statistics, and benchmark integrity."
  ]
}
